{
  "image_hash": "aaaaaaaaaaaaaaaaaaaaaaaaaaaaaaaaaaaaaaaaaaaaaaaaaaaaaaaaaaaaaaaa",
  "cache_key": "aaaaaaaaaaaaaaaaaaaaaaaaaaaaaaaaaaaaaaaaaaaaaaaaaaaaaaaaaaaaaaaa:easyocr-1.7:en:original",
  "engine": "easyocr",
  "engine_version": "1.7.2",
  "language_config": ["en"],
  "preprocessing_config": "original",
  "processed_at": "2026-10-26T12:05:00Z",
  "status": "success",
  "text": "Data workshop",
  "boxes": [
    {
      "text": "Data workshop",
      "confidence": 0.96,
      "polygon": [
        { "x": 12, "y": 20 },
        { "x": 290, "y": 20 },
        { "x": 290, "y": 66 },
        { "x": 12, "y": 66 }
      ]
    }
  ]
}
